{
  "_metadata": {
    "artifact_id": "question_flow",
    "version": "1.0",
    "schema_version": "1.0",
    "country": "ng",
    "release_status": "candidate_unapproved",
    "release_date": null,
    "may_publish": false,
    "generated_at": "2026-08-16T00:00:00Z",
    "generator": "tools/build_question_candidate.py",
    "generator_version": "1.0.0",
    "tooling_version": "1.0.0",
    "description": "WellaPath Adaptive Question Flow CANDIDATE \u2014 the first versioned representation of a flow that currently exists only as Dart source. Not published, not clinically approved, not consumed by any build.",
    "source": {
      "repository": "Wellapath-org/wellapath-mobile",
      "commit": "a269168e2ed9b3b1c0453797dce5c9f303366854",
      "vendored_files": [
        {
          "file": "baseline/questions_v1/followup_question_map.vendored.dart",
          "sha256": "074b5374b5729e613ab55490d1e483191fc1cf54823fae3d5cc008ba0710047d"
        },
        {
          "file": "baseline/questions_v1/red_flag_clarifiers.vendored.dart",
          "sha256": "f8050551af886ea98f6376052a5a53fcdaa0fb8ccbeec19f3ab0440dd17e922c"
        },
        {
          "file": "baseline/questions_v1/symptom_display_map.vendored.dart",
          "sha256": "95197adc3a9ff6c03c3e64e9c3acd6fe5e93541802acee77e5fce971a84acd8b"
        },
        {
          "file": "baseline/questions_v1/question_engine.vendored.dart",
          "sha256": "83e954acec978a15c390ae5e92704c6cbcdcc1ff173238c840053cafe834fdd5"
        },
        {
          "file": "baseline/questions_v1/assessment_controller.vendored.dart",
          "sha256": "19dd1208a6efaf83b43545f7cadf904492c78a3ce30707938ecce35ddc493a0c"
        },
        {
          "file": "baseline/questions_v1/followup_screen.vendored.dart",
          "sha256": "7805228d29b544ce42638c4ebf18a17b4dc4a7d092dfbe6a19b77625c6ffba4c"
        },
        {
          "file": "baseline/questions_v1/followup_question.vendored.dart",
          "sha256": "d81f19adf6bbedae4d74175d6f5ba08ca6ef48374ae4646b8d6853c732f63ae0"
        }
      ]
    },
    "frozen_clinical_inputs": {
      "token_dictionary_v1_1": "0cc47ad9537c0bd4c6ef3aec8f1931eb9b4c62103a8809d16544f94a90b5c019",
      "kb_v2_4": "6c00d8257f8417e86bd5e237630bf8a4623ad72e2e46b1b071dd447c067cec2b",
      "rules_v2_2": "1d27e854cba95b179577a88f92445400f494a7fe8e6a53a60fcaa98b3870d1c4"
    },
    "vocabulary_2_0": {
      "used": false,
      "note": "W3 branching resolves canonical token IDs from token_dictionary 1.1 only. No alias, association or other Vocabulary 2.0 metadata participates in question eligibility."
    },
    "clinical_review": {
      "status": "not_reviewed",
      "reviewer": null,
      "review_date": null,
      "evidence": null
    },
    "impedance_mismatches": [
      {
        "id": "IM-001",
        "area": "question selection",
        "current_behaviour": "Severity and duration questions are chosen by `severityQuestion ??= question` while iterating the SELECTED symptom tokens, so which wording is asked depends on the order the user tapped symptoms.",
        "candidate_behaviour": "Selection is by a declared deterministic tie_break_key (the trigger token id, ascending), so the same symptom set always yields the same question regardless of selection order.",
        "is_behaviour_change": true,
        "clinically_substantive": false,
        "justification": "The competing questions differ only in wording ('How severe is your headache?' vs 'How severe is this pain?'). No token effect, weight, red flag or urgency differs. The current behaviour is non-deterministic in a way W3 explicitly forbids, and a tie with no declared resolution is a validation failure under this contract.",
        "requires_review": "product \u2014 wording selection only"
      },
      {
        "id": "IM-002",
        "area": "red-flag timing",
        "current_behaviour": "Answers are committed only after the LAST follow-up question, so a red-flag clarifier 'yes' does not interrupt; the red flag is evaluated once, in the engine, after every question has been shown.",
        "candidate_behaviour": "Every red-flag-affecting question declares evaluate_after_answer=true and blocks_next_question=true, requiring evaluation immediately after that answer.",
        "is_behaviour_change": true,
        "clinically_substantive": true,
        "justification": "This makes red-flag detection strictly EARLIER, never later. It cannot suppress a red flag that fires today; it can only fire the same red flag sooner. Implementing it is Mobile work in a later W3 step and is NOT done here.",
        "requires_review": "engineering lead \u2014 behaviour change in Mobile, clinically safe direction"
      },
      {
        "id": "IM-003",
        "area": "adaptive re-branching",
        "current_behaviour": "The question list is computed once from the pre-screen symptom set. Tokens added by an additionalSymptoms answer generate no further questions.",
        "candidate_behaviour": "trigger_condition is re-evaluated against current state, so a newly derived token can make a further question eligible.",
        "is_behaviour_change": true,
        "clinically_substantive": false,
        "justification": "Strictly additive: it can only ask MORE questions, never fewer, and the truncation limit still bounds the total. No existing question is removed or reworded.",
        "requires_review": "product \u2014 path length impact"
      },
      {
        "id": "IM-004",
        "area": "answer identity",
        "current_behaviour": "Answers are keyed by list index (Map<int, dynamic>), meaningful only against the exact list built at initState.",
        "candidate_behaviour": "Answers are keyed by stable question_id and answer_option_id.",
        "is_behaviour_change": false,
        "clinically_substantive": false,
        "justification": "A representation change with no user-visible effect. Required before answer editing can invalidate dependents safely.",
        "requires_review": "none"
      },
      {
        "id": "IM-005",
        "area": "truncation safety",
        "current_behaviour": "Truncation to 5 is applied to the whole list. No clarifier is dropped today only because there are 3 of them and they sort first.",
        "candidate_behaviour": "red_flag_questions_exempt_from_truncation is a schema constant `true`; a red-flag-affecting question is never dropped to satisfy a length limit.",
        "is_behaviour_change": false,
        "clinically_substantive": false,
        "justification": "Makes an incidental property structural. Same observable behaviour on today's data.",
        "requires_review": "none"
      },
      {
        "id": "IM-006",
        "area": "demographic screens",
        "current_behaviour": "Sex, age, pregnancy, medical conditions and body area are separate Flutter screens with hardcoded navigation, not entries in any question list.",
        "candidate_behaviour": "Represented as questions with trigger_condition and priority, so the whole flow is one ordered graph.",
        "is_behaviour_change": false,
        "clinically_substantive": false,
        "justification": "The pregnancy gate is projected exactly as implemented: {\"sex\": \"female\"}. Age and medical-condition token mappings are copied verbatim. Body area produces no token, as today.",
        "requires_review": "none"
      },
      {
        "id": "IM-007",
        "area": "skip",
        "current_behaviour": "No skip mechanism exists. Every presented question must be answered or the assessment cancelled.",
        "candidate_behaviour": "The schema supports `skippable`, but every projected question is `skippable: false` \u2014 the projection introduces no skip.",
        "is_behaviour_change": false,
        "clinically_substantive": false,
        "justification": "Capability without use. Making any question skippable is a separate, reviewed decision.",
        "requires_review": "product + clinical, per question, before any question is marked skippable"
      }
    ],
    "parity_claim": "Behaviourally equivalent for question CONTENT, answer meaning and token effects. NOT identical for timing and determinism: see impedance_mismatches IM-001, IM-002 and IM-003, each of which is a deliberate, documented difference in a safe direction, not an accidental drift.",
    "changelog": [
      "First versioned representation of the existing question flow.",
      "No question added, removed or reworded; no answer meaning or token effect changed.",
      "Declared deterministic tie-break replaces selection-order dependence (IM-001).",
      "Red-flag-affecting questions declare immediate evaluation (IM-002) \u2014 specified, not yet implemented in Mobile.",
      "Not published; may_publish is false and no clinical review is recorded."
    ],
    "provenance": [
      "Projected from wellapath-mobile a269168e2ed9b3b1c0453797dce5c9f303366854 by tools/build_question_candidate.py.",
      "Every question, answer label and produced token is copied from the vendored Dart, not authored here.",
      "No PHI and no real-user assessment data: this artifact contains only question definitions and token identifiers already published in token_dictionary 1.1."
    ]
  },
  "condition_language": {
    "version": "1.0.0",
    "operators": [
      "age_range",
      "all",
      "always",
      "any",
      "equals",
      "never",
      "not",
      "one_of",
      "pregnancy",
      "prior_answer_equals",
      "sex",
      "token_absent",
      "token_present"
    ],
    "fields": [
      "age_token",
      "assessment_phase",
      "body_area",
      "sex"
    ]
  },
  "path_controls": {
    "max_questions_per_assessment": 11,
    "max_followup_questions": 5,
    "max_questions_per_complaint_path": null,
    "red_flag_questions_exempt_from_truncation": true,
    "truncation_allowed": true,